Path: news.gmane.org!not-for-mail
From: Alexei Kornienko <alexei.kornienko@gmail.com>
Newsgroups: gmane.linux.kernel
Subject: PROBLEM: snd_hda_intel bug during boot
Date: Wed, 8 Aug 2012 22:35:35 +0300
Lines: 1095
Approved: news@gmane.org
Message-ID: <CA+h=+L8geO5kM8VV-+VFkSrvBRJEs31V9OaQ6g98hirRKJWq1g@mail.gmail.com>
NNTP-Posting-Host: plane.gmane.org
Mime-Version: 1.0
Content-Type: text/plain; charset=ISO-8859-1
X-Trace: dough.gmane.org 1344454560 29324 80.91.229.3 (8 Aug 2012 19:36:00 GMT)
X-Complaints-To: usenet@dough.gmane.org
NNTP-Posting-Date: Wed, 8 Aug 2012 19:36:00 +0000 (UTC)
To: linux-kernel@vger.kernel.org
Original-X-From: linux-kernel-owner@vger.kernel.org Wed Aug 08 21:35:55 2012
Return-path: <linux-kernel-owner@vger.kernel.org>
Envelope-to: glk-linux-kernel-3@plane.gmane.org
Original-Received: from vger.kernel.org ([209.132.180.67])
	by plane.gmane.org with esmtp (Exim 4.69)
	(envelope-from <linux-kernel-owner@vger.kernel.org>)
	id 1SzC2r-0000H5-IE
	for glk-linux-kernel-3@plane.gmane.org; Wed, 08 Aug 2012 21:35:54 +0200
Original-Received: (majordomo@vger.kernel.org) by vger.kernel.org via listexpand
	id S1030746Ab2HHTfm (ORCPT <rfc822;glk-linux-kernel-3@m.gmane.org>);
	Wed, 8 Aug 2012 15:35:42 -0400
Original-Received: from mail-wg0-f44.google.com ([74.125.82.44]:37127 "EHLO
	mail-wg0-f44.google.com" rhost-flags-OK-OK-OK-OK) by vger.kernel.org
	with ESMTP id S1753318Ab2HHTfh (ORCPT
	<rfc822;linux-kernel@vger.kernel.org>);
	Wed, 8 Aug 2012 15:35:37 -0400
Original-Received: by wgbdr13 with SMTP id dr13so1046486wgb.1
        for <linux-kernel@vger.kernel.org>; Wed, 08 Aug 2012 12:35:35 -0700 (PDT)
DKIM-Signature: v=1; a=rsa-sha256; c=relaxed/relaxed;
        d=gmail.com; s=20120113;
        h=mime-version:date:message-id:subject:from:to:content-type;
        bh=0xQKk39bJsGJm3ajgzEE1sJrhjsh5WGwtE+vUXSLHK0=;
        b=llJP4PqxWWASco44v45jv1l/JarIbK++Qmr27XvYTWXng/d5/gOF99X6IULxag4EPl
         mCkGtSeumCw1lhsjzCHZfcKdjWnhdTRp5cfa0NO6WQdjQOj6GXcpiMS7GbxROXXkfQoS
         8nK9KLzikDPj+9whrl+sCLHBitN2ar1F1YJDMcOKSKETRi/J7upgO/aYVpS/raMaw2AF
         fqH/OEHMFyf4jjuzJNKLrMu3gNmtjCcfYZeMZ1IAO9P/rQWHD35v1IWAs6n6E4rARgTC
         Xx3nAoIT0poyPORaz91+bNnPiKfuUF2+s4Tz2h4Rxvr2JbTpdpm1WGqJhOtYIvo4DtNP
         Vg4g==
Original-Received: by 10.180.93.68 with SMTP id cs4mr230394wib.14.1344454535623; Wed,
 08 Aug 2012 12:35:35 -0700 (PDT)
Original-Received: by 10.194.29.99 with HTTP; Wed, 8 Aug 2012 12:35:35 -0700 (PDT)
Original-Sender: linux-kernel-owner@vger.kernel.org
Precedence: bulk
List-ID: <linux-kernel.vger.kernel.org>
X-Mailing-List: linux-kernel@vger.kernel.org
Xref: news.gmane.org gmane.linux.kernel:1340270
Archived-At: <http://permalink.gmane.org/gmane.linux.kernel/1340270>

Seems like I have a bug in audio driver on my laptop. Cause of this I
don't have any sound card detected.
Please find more details below:

** Version:
Linux version 3.2.0-29-generic-pae (buildd@roseapple) (gcc version
4.6.3 (Ubuntu/Linaro 4.6.3-1ubuntu5) ) #46-Ubuntu SMP Fri Jul 27
17:25:43 UTC 2012

** Tainted:
1152

** Error trace:
Aug  8 22:09:13 alex-Laptop kernel: [   21.442831] iwl3945: Intel(R)
PRO/Wireless 3945ABG/BG Network Connection driver for Linux, in-tree:s
Aug  8 22:09:13 alex-Laptop kernel: [   21.442835] iwl3945:
Copyright(c) 2003-2011 Intel Corporation
Aug  8 22:09:13 alex-Laptop kernel: [   21.442907] iwl3945
0000:05:00.0: PCI INT A -> GSI 19 (level, low) -> IRQ 19
Aug  8 22:09:13 alex-Laptop kernel: [   21.442923] iwl3945
0000:05:00.0: setting latency timer to 64
Aug  8 22:09:13 alex-Laptop kernel: [   21.483129] iwl3945
0000:05:00.0: Tunable channels: 13 802.11bg, 0 802.11a channels
Aug  8 22:09:13 alex-Laptop kernel: [   21.483133] iwl3945
0000:05:00.0: Detected Intel Wireless WiFi Link 3945BG
Aug  8 22:09:13 alex-Laptop kernel: [   21.483288] iwl3945
0000:05:00.0: irq 45 for MSI/MSI-X
Aug  8 22:09:13 alex-Laptop kernel: [   21.483535] Registered led
device: phy0-led
Aug  8 22:09:13 alex-Laptop kernel: [   21.483610] cfg80211: Ignoring
regulatory request Set by core since the driver uses its own custom
regulatory domain
Aug  8 22:09:13 alex-Laptop kernel: [   21.763424] snd_hda_intel
0000:00:1b.0: PCI INT A -> GSI 22 (level, low) -> IRQ 22
Aug  8 22:09:13 alex-Laptop kernel: [   21.763500] snd_hda_intel
0000:00:1b.0: irq 46 for MSI/MSI-X
Aug  8 22:09:13 alex-Laptop kernel: [   21.763537] snd_hda_intel
0000:00:1b.0: setting latency timer to 64
Aug  8 22:09:13 alex-Laptop kernel: [   22.007311] ieee80211 phy0:
Selected rate control algorithm 'iwl-3945-rs'
Aug  8 22:09:13 alex-Laptop kernel: [   22.182032] hda_codec: ALC883:
BIOS auto-probing.
Aug  8 22:09:13 alex-Laptop kernel: [   22.182037] hda_codec: ALC883:
SKU not ready 0x411111f0
Aug  8 22:09:13 alex-Laptop kernel: [   22.183949] BUG: unable to
handle kernel NULL pointer dereference at 00000002
Aug  8 22:09:13 alex-Laptop kernel: [   22.183971] IP: [<c12b7235>]
strcmp+0x15/0x30
Aug  8 22:09:13 alex-Laptop kernel: [   22.183985] *pdpt =
0000000036d57001 *pde = 0000000000000000
Aug  8 22:09:13 alex-Laptop kernel: [   22.183996] Oops: 0000 [#1] SMP
Aug  8 22:09:13 alex-Laptop kernel: [   22.184004] Modules linked in:
snd_hda_codec_realtek arc4 snd_hda_intel(+) snd_hda_codec snd_hwdep
snd_pcm iwl3945 snd_seq_midi tifm_sd snd_rawmidi snd_seq_midi_event
tifm_7xx1 joydev snd_seq iwl_legacy tifm_core snd_timer snd_seq_device
mac80211 pcmcia binfmt_misc psmouse btusb snd bluetooth soundcore
cfg80211 yenta_socket pcmcia_rsrc pcmcia_core snd_page_alloc serio_raw
et131x(C) mac_hid ppdev parport_pc lp parport hid_a4tech usbhid hid
nouveau ttm drm_kms_helper drm i2c_algo_bit mxm_wmi firewire_ohci
firewire_core crc_itu_t sdhci_pci sdhci video wmi
Aug  8 22:09:13 alex-Laptop kernel: [   22.184009]
Aug  8 22:09:13 alex-Laptop kernel: [   22.184009] Pid: 549, comm:
modprobe Tainted: G         C   3.2.0-29-generic-pae #46-Ubuntu LG
Electronics M1-KP65R1/ROCKY
Aug  8 22:09:13 alex-Laptop kernel: [   22.184009] EIP:
0060:[<c12b7235>] EFLAGS: 00010282 CPU: 0
Aug  8 22:09:13 alex-Laptop kernel: [   22.184009] EIP is at strcmp+0x15/0x30
Aug  8 22:09:13 alex-Laptop kernel: [   22.184009] EAX: 00000002 EBX:
00000002 ECX: 00000004 EDX: faadc998
Aug  8 22:09:13 alex-Laptop kernel: [   22.184009] ESI: 00000002 EDI:
faadc998 EBP: f02ebd6c ESP: f02ebd64
Aug  8 22:09:13 alex-Laptop kernel: [   22.184009]  DS: 007b ES: 007b
FS: 00d8 GS: 00e0 SS: 0068
Aug  8 22:09:13 alex-Laptop kernel: [   22.184009] Process modprobe
(pid: 549, ti=f02ea000 task=f6d7cc20 task.ti=f02ea000)
Aug  8 22:09:13 alex-Laptop kernel: [   22.184009] Stack:
Aug  8 22:09:13 alex-Laptop kernel: [   22.184009]  00000004 ef985000
f02ebda4 faac0a46 00000018 00000003 ef9852c0 ef8b5870
Aug  8 22:09:13 alex-Laptop kernel: [   22.184009]  0019c000 00000005
ef8b5800 00000026 00000000 ef985000 ef8b5800 faac5b24
Aug  8 22:09:13 alex-Laptop kernel: [   22.184009]  f02ebdc4 faac1dd5
00000000 ef9d9048 ef9852c0 ef8b5800 ef985000 00000000
Aug  8 22:09:13 alex-Laptop kernel: [   22.184009] Call Trace:
Aug  8 22:09:13 alex-Laptop kernel: [   22.184009]  [<faac0a46>]
alc_auto_create_multi_out_ctls+0x96/0x1c0 [snd_hda_codec_realtek]
Aug  8 22:09:13 alex-Laptop kernel: [   22.184009]  [<faac1dd5>]
alc_parse_auto_config+0x85/0x280 [snd_hda_codec_realtek]
Aug  8 22:09:13 alex-Laptop kernel: [   22.184009]  [<faac2b3e>]
patch_alc882+0x21e/0x320 [snd_hda_codec_realtek]
Aug  8 22:09:13 alex-Laptop kernel: [   22.184009]  [<fa856a4f>]
snd_hda_codec_configure+0x5f/0x190 [snd_hda_codec]
Aug  8 22:09:13 alex-Laptop kernel: [   22.184009]  [<fa0de650>] ?
azx_get_response+0x30/0x30 [snd_hda_intel]
Aug  8 22:09:13 alex-Laptop kernel: [   22.184009]  [<fa0de050>] ?
azx_power_notify+0x70/0x70 [snd_hda_intel]
Aug  8 22:09:13 alex-Laptop kernel: [   22.184009]  [<fa0ddfe0>] ?
azx_stop_chip+0x20/0x20 [snd_hda_intel]
Aug  8 22:09:13 alex-Laptop kernel: [   22.184009]  [<fa0df2c2>]
azx_probe+0x14e/0x212 [snd_hda_intel]
Aug  8 22:09:13 alex-Laptop kernel: [   22.184009]  [<c12d0ff7>]
local_pci_probe+0x47/0xb0
Aug  8 22:09:13 alex-Laptop kernel: [   22.184009]  [<c12d24d8>]
pci_device_probe+0x68/0x90
Aug  8 22:09:13 alex-Laptop kernel: [   22.184009]  [<c11a7df7>] ?
sysfs_create_link+0x17/0x20
Aug  8 22:09:13 alex-Laptop kernel: [   22.184009]  [<c13845bd>]
really_probe+0x4d/0x150
Aug  8 22:09:13 alex-Laptop kernel: [   22.184009]  [<c138dc29>] ?
pm_runtime_barrier+0x49/0xb0
Aug  8 22:09:13 alex-Laptop kernel: [   22.184009]  [<c13847fa>]
driver_probe_device+0x3a/0x60
Aug  8 22:09:13 alex-Laptop kernel: [   22.184009]  [<c13848b1>]
__driver_attach+0x91/0xa0
Aug  8 22:09:13 alex-Laptop kernel: [   22.184009]  [<c1384820>] ?
driver_probe_device+0x60/0x60
Aug  8 22:09:13 alex-Laptop kernel: [   22.184009]  [<c1383939>]
bus_for_each_dev+0x49/0x70
Aug  8 22:09:13 alex-Laptop kernel: [   22.184009]  [<c13843f1>]
driver_attach+0x21/0x30
Aug  8 22:09:13 alex-Laptop kernel: [   22.184009]  [<c1384820>] ?
driver_probe_device+0x60/0x60
Aug  8 22:09:13 alex-Laptop kernel: [   22.184009]  [<c13840cf>]
bus_add_driver+0x17f/0x260
Aug  8 22:09:13 alex-Laptop kernel: [   22.184009]  [<c12d2500>] ?
pci_device_probe+0x90/0x90
Aug  8 22:09:13 alex-Laptop kernel: [   22.184009]  [<c1384d86>]
driver_register+0x66/0x110
Aug  8 22:09:13 alex-Laptop kernel: [   22.184009]  [<c12d2282>]
__pci_register_driver+0x42/0xc0
Aug  8 22:09:13 alex-Laptop kernel: [   22.184009]  [<f87a4017>]
alsa_card_azx_init+0x17/0x1000 [snd_hda_intel]
Aug  8 22:09:13 alex-Laptop kernel: [   22.184009]  [<c1003035>]
do_one_initcall+0x35/0x170
Aug  8 22:09:13 alex-Laptop kernel: [   22.184009]  [<f87a4000>] ? 0xf87a3fff
Aug  8 22:09:13 alex-Laptop kernel: [   22.184009]  [<c1095b4d>]
sys_init_module+0xad/0x210
Aug  8 22:09:13 alex-Laptop kernel: [   22.184009]  [<c15ac7df>]
sysenter_do_call+0x12/0x28
Aug  8 22:09:13 alex-Laptop kernel: [   22.184009] Code: 5d f4 8b 7d
fc 89 ec 5d c3 8d b6 00 00 00 00 8d bc 27 00 00 00 00 55 89 e5 83 ec
08 89 75 f8 89 7d fc 3e 8d 74 26 00 89 c6 89 d7 <ac> ae 75 08 84 c0 75
f8 31 c0 eb 04 19 c0 0c 01 8b 75 f8 8b 7d
Aug  8 22:09:13 alex-Laptop kernel: [   22.184009] EIP: [<c12b7235>]
strcmp+0x15/0x30 SS:ESP 0068:f02ebd64
Aug  8 22:09:13 alex-Laptop kernel: [   22.184009] CR2: 0000000000000002
Aug  8 22:09:13 alex-Laptop kernel: [   22.184699] ---[ end trace
91e25dcae379e705 ]---
Aug  8 22:09:13 alex-Laptop kernel: [   22.446646] cfg80211: Ignoring
regulatory request Set by core since the driver uses its own custom
regulatory domain

** CPU info:
processor	: 0
vendor_id	: GenuineIntel
cpu family	: 6
model		: 15
model name	: Intel(R) Core(TM)2 CPU         T5600  @ 1.83GHz
stepping	: 6
microcode	: 0x48
cpu MHz		: 1833.000
cache size	: 2048 KB
physical id	: 0
siblings	: 2
core id		: 0
cpu cores	: 2
apicid		: 0
initial apicid	: 0
fdiv_bug	: no
hlt_bug		: no
f00f_bug	: no
coma_bug	: no
fpu		: yes
fpu_exception	: yes
cpuid level	: 10
wp		: yes
flags		: fpu vme de pse tsc msr pae mce cx8 apic sep mtrr pge mca cmov
pat pse36 clflush dts acpi mmx fxsr sse sse2 ss ht tm pbe nx lm
constant_tsc arch_perfmon pebs bts aperfmperf pni dtes64 monitor
ds_cpl vmx est tm2 ssse3 cx16 xtpr pdcm lahf_lm dtherm tpr_shadow
bogomips	: 3657.41
clflush size	: 64
cache_alignment	: 64
address sizes	: 36 bits physical, 48 bits virtual
power management:

processor	: 1
vendor_id	: GenuineIntel
cpu family	: 6
model		: 15
model name	: Intel(R) Core(TM)2 CPU         T5600  @ 1.83GHz
stepping	: 6
microcode	: 0x48
cpu MHz		: 1833.000
cache size	: 2048 KB
physical id	: 0
siblings	: 2
core id		: 1
cpu cores	: 2
apicid		: 1
initial apicid	: 1
fdiv_bug	: no
hlt_bug		: no
f00f_bug	: no
coma_bug	: no
fpu		: yes
fpu_exception	: yes
cpuid level	: 10
wp		: yes
flags		: fpu vme de pse tsc msr pae mce cx8 apic sep mtrr pge mca cmov
pat pse36 clflush dts acpi mmx fxsr sse sse2 ss ht tm pbe nx lm
constant_tsc arch_perfmon pebs bts aperfmperf pni dtes64 monitor
ds_cpl vmx est tm2 ssse3 cx16 xtpr pdcm lahf_lm dtherm tpr_shadow
bogomips	: 3657.53
clflush size	: 64
cache_alignment	: 64
address sizes	: 36 bits physical, 48 bits virtual
power management:


** Module information:
bnep 17830 2 - Live 0x00000000
dm_crypt 22528 1 - Live 0x00000000
rfcomm 38139 12 - Live 0x00000000
snd_hda_codec_realtek 174222 1 - Live 0x00000000
arc4 12473 2 - Live 0x00000000
snd_hda_intel 47635 1 - Loading 0x00000000
snd_hda_codec 109562 2 snd_hda_codec_realtek,snd_hda_intel, Live 0x00000000
snd_hwdep 13276 1 snd_hda_codec, Live 0x00000000
snd_pcm 80845 2 snd_hda_intel,snd_hda_codec, Live 0x00000000
iwl3945 73152 0 - Live 0x00000000
snd_seq_midi 13132 0 - Live 0x00000000
tifm_sd 17566 0 - Live 0x00000000
snd_rawmidi 25424 1 snd_seq_midi, Live 0x00000000
snd_seq_midi_event 14475 1 snd_seq_midi, Live 0x00000000
tifm_7xx1 12937 0 - Live 0x00000000
joydev 17393 0 - Live 0x00000000
snd_seq 51567 2 snd_seq_midi,snd_seq_midi_event, Live 0x00000000
iwl_legacy 71134 1 iwl3945, Live 0x00000000
tifm_core 15040 2 tifm_sd,tifm_7xx1, Live 0x00000000
snd_timer 28931 2 snd_pcm,snd_seq, Live 0x00000000
snd_seq_device 14172 3 snd_seq_midi,snd_rawmidi,snd_seq, Live 0x00000000
mac80211 436455 2 iwl3945,iwl_legacy, Live 0x00000000
pcmcia 39791 0 - Live 0x00000000
binfmt_misc 17292 1 - Live 0x00000000
psmouse 72919 0 - Live 0x00000000
btusb 17912 2 - Live 0x00000000
snd 62064 9 snd_hda_codec_realtek,snd_hda_intel,snd_hda_codec,snd_hwdep,snd_pcm,snd_rawmidi,snd_seq,snd_timer,snd_seq_device,
Live 0x00000000
bluetooth 158438 23 bnep,rfcomm,btusb, Live 0x00000000
soundcore 14635 1 snd, Live 0x00000000
cfg80211 178679 3 iwl3945,iwl_legacy,mac80211, Live 0x00000000
yenta_socket 27465 0 - Live 0x00000000
pcmcia_rsrc 18367 1 yenta_socket, Live 0x00000000
pcmcia_core 21511 3 pcmcia,yenta_socket,pcmcia_rsrc, Live 0x00000000
snd_page_alloc 14108 2 snd_hda_intel,snd_pcm, Live 0x00000000
serio_raw 13027 0 - Live 0x00000000
et131x 40557 0 - Live 0x00000000 (C)
mac_hid 13077 0 - Live 0x00000000
ppdev 12849 0 - Live 0x00000000
parport_pc 32114 1 - Live 0x00000000
lp 17455 0 - Live 0x00000000
parport 40930 3 ppdev,parport_pc,lp, Live 0x00000000
hid_a4tech 12590 0 - Live 0x00000000
usbhid 41906 0 - Live 0x00000000
hid 77367 2 hid_a4tech,usbhid, Live 0x00000000
nouveau 712356 2 - Live 0x00000000
ttm 65344 1 nouveau, Live 0x00000000
drm_kms_helper 45466 1 nouveau, Live 0x00000000
drm 197692 4 nouveau,ttm,drm_kms_helper, Live 0x00000000
i2c_algo_bit 13199 1 nouveau, Live 0x00000000
mxm_wmi 12859 1 nouveau, Live 0x00000000
firewire_ohci 40172 0 - Live 0x00000000
firewire_core 56906 1 firewire_ohci, Live 0x00000000
crc_itu_t 12627 1 firewire_core, Live 0x00000000
sdhci_pci 18324 0 - Live 0x00000000
sdhci 28241 1 sdhci_pci, Live 0x00000000
video 19068 1 nouveau, Live 0x00000000
wmi 18744 1 mxm_wmi, Live 0x00000000

** Loaded driver and hardware information (/proc/ioports, /proc/iomem):
0000-001f : dma1
0020-0021 : pic1
0040-0043 : timer0
0050-0053 : timer1
0060-0060 : keyboard
0062-0062 : EC data
0064-0064 : keyboard
0066-0066 : EC cmd
0070-0077 : rtc0
0080-008f : dma page reg
00a0-00a1 : pic2
00c0-00df : dma2
00f0-00ff : fpu
0170-0177 : 0000:00:1f.1
  0170-0177 : ata_piix
01f0-01f7 : 0000:00:1f.1
  01f0-01f7 : ata_piix
0376-0376 : 0000:00:1f.1
  0376-0376 : ata_piix
0378-037a : parport0
03c0-03df : vga+
03f6-03f6 : 0000:00:1f.1
  03f6-03f6 : ata_piix
03f8-03ff : serial
0680-069f : pnp 00:06
06a0-06af : pnp 00:07
06b0-06ff : pnp 00:07
0778-077a : parport0
0800-080f : pnp 00:06
0cf8-0cff : PCI conf1
1000-107f : 0000:00:1f.0
  1000-107f : pnp 00:06
    1000-1003 : ACPI PM1a_EVT_BLK
    1004-1005 : ACPI PM1a_CNT_BLK
    1008-100b : ACPI PM_TMR
    1010-1015 : ACPI CPU throttle
    1020-1020 : ACPI PM2_CNT_BLK
    1028-102f : ACPI GPE0_BLK
1180-11bf : 0000:00:1f.0
  1180-11bf : pnp 00:06
1640-164f : pnp 00:06
1800-181f : 0000:00:1d.0
  1800-181f : uhci_hcd
1820-183f : 0000:00:1d.1
  1820-183f : uhci_hcd
1840-185f : 0000:00:1d.2
  1840-185f : uhci_hcd
1860-187f : 0000:00:1d.3
  1860-187f : uhci_hcd
1880-188f : 0000:00:1f.1
  1880-188f : ata_piix
18a8-18ab : 0000:00:1f.2
  18a8-18ab : ahci
18ac-18af : 0000:00:1f.2
  18ac-18af : ahci
18b0-18bf : 0000:00:1f.2
  18b0-18bf : ahci
18c0-18c7 : 0000:00:1f.2
  18c0-18c7 : ahci
18c8-18cf : 0000:00:1f.2
  18c8-18cf : ahci
18e0-18ff : 0000:00:1f.3
2000-2fff : PCI Bus 0000:02
3000-3fff : PCI Bus 0000:03
4000-4fff : PCI Bus 0000:06
  4000-40ff : PCI CardBus 0000:07
  4400-44ff : PCI CardBus 0000:07
5000-5fff : PCI Bus 0000:05

00000000-0000ffff : reserved
00010000-0009f7ff : System RAM
0009f800-0009ffff : reserved
000a0000-000bffff : Video RAM area
000c0000-000cedff : Video ROM
000dc000-000fffff : reserved
  000f0000-000fffff : System ROM
00100000-9fedffff : System RAM
  01000000-015adb63 : Kernel code
  015adb64-0187423f : Kernel data
  01934000-01a0cfff : Kernel bss
9fee0000-9fefffff : ACPI Non-volatile Storage
9ff00000-9fffffff : reserved
a0000000-a3ffffff : PCI Bus 0000:06
  a0000000-a3ffffff : PCI CardBus 0000:07
a4000000-a41fffff : PCI Bus 0000:05
a8000000-a8000fff : 0000:06:00.0
  a8000000-a8000fff : yenta_socket
ac000000-afffffff : PCI CardBus 0000:07
c0000000-cfffffff : PCI Bus 0000:01
  c0000000-cfffffff : 0000:01:00.0
d0000000-d1ffffff : PCI Bus 0000:02
  d0000000-d001ffff : 0000:02:00.0
d2000000-d3ffffff : PCI Bus 0000:03
d4000000-d5ffffff : PCI Bus 0000:02
  d4000000-d41fffff : 0000:02:00.0
    d4000000-d41fffff : et131x
d6000000-d7ffffff : PCI Bus 0000:03
d8000000-d9ffffff : PCI Bus 0000:01
  d8000000-d8ffffff : 0000:01:00.0
  d9000000-d9ffffff : 0000:01:00.0
da000000-da0fffff : PCI Bus 0000:06
  da000000-da003fff : 0000:06:00.1
  da004000-da004fff : 0000:06:00.2
    da004000-da004fff : tifm_7xx1
  da005000-da0057ff : 0000:06:00.1
    da005000-da0057ff : firewire_ohci
  da005800-da0058ff : 0000:06:00.3
    da005800-da0058ff : mmc0
da100000-da1fffff : PCI Bus 0000:05
  da100000-da100fff : 0000:05:00.0
    da100000-da100fff : iwl3945
da400000-da403fff : 0000:00:1b.0
  da400000-da403fff : ICH HD audio
da404000-da4043ff : 0000:00:1d.7
  da404000-da4043ff : ehci_hcd
da404400-da4047ff : 0000:00:1f.2
  da404400-da4047ff : ahci
e0000000-efffffff : PCI MMCONFIG 0000 [bus 00-ff]
  e0000000-efffffff : reserved
    e0000000-efffffff : pnp 00:01
fec00000-fec0ffff : reserved
  fec00000-fec003ff : IOAPIC 0
fed00000-fed003ff : HPET 0
  fed00000-fed003ff : reserved
    fed00000-fed003ff : pnp 00:04
fed14000-fed19fff : reserved
  fed14000-fed17fff : pnp 00:01
  fed18000-fed18fff : pnp 00:01
  fed19000-fed19fff : pnp 00:01
fed1c000-fed8ffff : reserved
  fed1c000-fed1ffff : pnp 00:01
  fed20000-fed3ffff : pnp 00:01
  fed40000-fed44fff : pnp 00:01
  fed45000-fed8ffff : pnp 00:01
fee00000-fee00fff : Local APIC
  fee00000-fee00fff : reserved
ff000000-ffffffff : reserved


** PCI information:
00:00.0 Host bridge: Intel Corporation Mobile 945GM/PM/GMS, 943/940GML
and 945GT Express Memory Controller Hub (rev 03)
	Subsystem: LG Electronics, Inc. Device 0040
	Control: I/O- Mem+ BusMaster+ SpecCycle- MemWINV- VGASnoop- ParErr-
Stepping- SERR+ FastB2B- DisINTx-
	Status: Cap+ 66MHz- UDF- FastB2B+ ParErr- DEVSEL=fast >TAbort-
<TAbort- <MAbort+ >SERR- <PERR- INTx-
	Latency: 0
	Capabilities: [e0] Vendor Specific Information: Len=09 <?>

00:01.0 PCI bridge: Intel Corporation Mobile 945GM/PM/GMS, 943/940GML
and 945GT Express PCI Express Root Port (rev 03) (prog-if 00 [Normal
decode])
	Control: I/O+ Mem+ BusMaster+ SpecCycle- MemWINV- VGASnoop- ParErr-
Stepping- SERR- FastB2B- DisINTx+
	Status: Cap+ 66MHz- UDF- FastB2B- ParErr- DEVSEL=fast >TAbort-
<TAbort- <MAbort- >SERR- <PERR- INTx-
	Latency: 0, Cache Line Size: 64 bytes
	Bus: primary=00, secondary=01, subordinate=01, sec-latency=0
	I/O behind bridge: 0000f000-00000fff
	Memory behind bridge: d8000000-d9ffffff
	Prefetchable memory behind bridge: 00000000c0000000-00000000cfffffff
	Secondary status: 66MHz- FastB2B- ParErr- DEVSEL=fast >TAbort-
<TAbort- <MAbort- <SERR- <PERR-
	BridgeCtl: Parity- SERR- NoISA- VGA+ MAbort- >Reset- FastB2B-
		PriDiscTmr- SecDiscTmr- DiscTmrStat- DiscTmrSERREn-
	Capabilities: [88] Subsystem: Intel Corporation Device 0000
	Capabilities: [80] Power Management version 2
		Flags: PMEClk- DSI- D1- D2- AuxCurrent=0mA PME(D0+,D1-,D2-,D3hot+,D3cold+)
		Status: D0 NoSoftRst- PME-Enable- DSel=0 DScale=0 PME-
	Capabilities: [90] MSI: Enable+ Count=1/1 Maskable- 64bit-
		Address: fee0300c  Data: 4169
	Capabilities: [a0] Express (v1) Root Port (Slot+), MSI 00
		DevCap:	MaxPayload 128 bytes, PhantFunc 0, Latency L0s <64ns, L1 <1us
			ExtTag- RBE- FLReset-
		DevCtl:	Report errors: Correctable- Non-Fatal- Fatal- Unsupported-
			RlxdOrd- ExtTag- PhantFunc- AuxPwr- NoSnoop-
			MaxPayload 128 bytes, MaxReadReq 128 bytes
		DevSta:	CorrErr- UncorrErr- FatalErr- UnsuppReq- AuxPwr- TransPend-
		LnkCap:	Port #2, Speed 2.5GT/s, Width x16, ASPM L0s L1, Latency L0
<256ns, L1 <4us
			ClockPM- Surprise- LLActRep- BwNot-
		LnkCtl:	ASPM Disabled; RCB 64 bytes Disabled- Retrain- CommClk+
			ExtSynch- ClockPM- AutWidDis- BWInt- AutBWInt-
		LnkSta:	Speed 2.5GT/s, Width x16, TrErr- Train- SlotClk+ DLActive-
BWMgmt- ABWMgmt-
		SltCap:	AttnBtn- PwrCtrl- MRL- AttnInd- PwrInd- HotPlug- Surprise-
			Slot #1, PowerLimit 75.000W; Interlock- NoCompl-
		SltCtl:	Enable: AttnBtn- PwrFlt- MRL- PresDet- CmdCplt- HPIrq- LinkChg-
			Control: AttnInd Off, PwrInd On, Power- Interlock-
		SltSta:	Status: AttnBtn- PowerFlt- MRL- CmdCplt- PresDet+ Interlock-
			Changed: MRL- PresDet+ LinkState-
		RootCtl: ErrCorrectable- ErrNon-Fatal- ErrFatal- PMEIntEna- CRSVisible-
		RootCap: CRSVisible-
		RootSta: PME ReqID 0000, PMEStatus- PMEPending-
	Capabilities: [100 v1] Virtual Channel
		Caps:	LPEVC=0 RefClk=100ns PATEntryBits=1
		Arb:	Fixed+ WRR32- WRR64- WRR128-
		Ctrl:	ArbSelect=Fixed
		Status:	InProgress-
		VC0:	Caps:	PATOffset=00 MaxTimeSlots=1 RejSnoopTrans-
			Arb:	Fixed- WRR32- WRR64- WRR128- TWRR128- WRR256-
			Ctrl:	Enable+ ID=0 ArbSelect=Fixed TC/VC=01
			Status:	NegoPending- InProgress-
	Capabilities: [140 v1] Root Complex Link
		Desc:	PortNumber=02 ComponentID=01 EltType=Config
		Link0:	Desc:	TargetPort=00 TargetComponent=01 AssocRCRB-
LinkType=MemMapped LinkValid+
			Addr:	00000000fed19000
	Kernel driver in use: pcieport
	Kernel modules: shpchp

00:1b.0 Audio device: Intel Corporation N10/ICH 7 Family High
Definition Audio Controller (rev 02)
	Subsystem: LG Electronics, Inc. Device 0040
	Control: I/O- Mem+ BusMaster+ SpecCycle- MemWINV- VGASnoop- ParErr-
Stepping- SERR- FastB2B- DisINTx+
	Status: Cap+ 66MHz- UDF- FastB2B- ParErr- DEVSEL=fast >TAbort-
<TAbort- <MAbort- >SERR- <PERR- INTx-
	Latency: 0, Cache Line Size: 64 bytes
	Interrupt: pin A routed to IRQ 46
	Region 0: Memory at da400000 (64-bit, non-prefetchable) [size=16K]
	Capabilities: [50] Power Management version 2
		Flags: PMEClk- DSI- D1- D2- AuxCurrent=55mA PME(D0+,D1-,D2-,D3hot+,D3cold+)
		Status: D0 NoSoftRst- PME-Enable- DSel=0 DScale=0 PME-
	Capabilities: [60] MSI: Enable+ Count=1/1 Maskable- 64bit+
		Address: 00000000fee0300c  Data: 41a1
	Capabilities: [70] Express (v1) Root Complex Integrated Endpoint, MSI 00
		DevCap:	MaxPayload 128 bytes, PhantFunc 0, Latency L0s <64ns, L1 <1us
			ExtTag- RBE- FLReset-
		DevCtl:	Report errors: Correctable- Non-Fatal- Fatal- Unsupported-
			RlxdOrd- ExtTag- PhantFunc- AuxPwr- NoSnoop+
			MaxPayload 128 bytes, MaxReadReq 128 bytes
		DevSta:	CorrErr- UncorrErr- FatalErr- UnsuppReq- AuxPwr+ TransPend-
		LnkCap:	Port #0, Speed unknown, Width x0, ASPM unknown, Latency L0
<64ns, L1 <1us
			ClockPM- Surprise- LLActRep- BwNot-
		LnkCtl:	ASPM Disabled; Disabled- Retrain- CommClk-
			ExtSynch- ClockPM- AutWidDis- BWInt- AutBWInt-
		LnkSta:	Speed unknown, Width x0, TrErr- Train- SlotClk- DLActive-
BWMgmt- ABWMgmt-
	Capabilities: [100 v1] Virtual Channel
		Caps:	LPEVC=0 RefClk=100ns PATEntryBits=1
		Arb:	Fixed- WRR32- WRR64- WRR128-
		Ctrl:	ArbSelect=Fixed
		Status:	InProgress-
		VC0:	Caps:	PATOffset=00 MaxTimeSlots=1 RejSnoopTrans-
			Arb:	Fixed- WRR32- WRR64- WRR128- TWRR128- WRR256-
			Ctrl:	Enable+ ID=0 ArbSelect=Fixed TC/VC=01
			Status:	NegoPending- InProgress-
		VC1:	Caps:	PATOffset=00 MaxTimeSlots=1 RejSnoopTrans-
			Arb:	Fixed- WRR32- WRR64- WRR128- TWRR128- WRR256-
			Ctrl:	Enable+ ID=1 ArbSelect=Fixed TC/VC=80
			Status:	NegoPending- InProgress-
	Capabilities: [130 v1] Root Complex Link
		Desc:	PortNumber=0f ComponentID=02 EltType=Config
		Link0:	Desc:	TargetPort=00 TargetComponent=02 AssocRCRB-
LinkType=MemMapped LinkValid+
			Addr:	00000000fed1c000
	Kernel driver in use: snd_hda_intel
	Kernel modules: snd-hda-intel

00:1c.0 PCI bridge: Intel Corporation N10/ICH 7 Family PCI Express
Port 1 (rev 02) (prog-if 00 [Normal decode])
	Control: I/O+ Mem+ BusMaster+ SpecCycle- MemWINV- VGASnoop- ParErr-
Stepping- SERR- FastB2B- DisINTx+
	Status: Cap+ 66MHz- UDF- FastB2B- ParErr- DEVSEL=fast >TAbort-
<TAbort- <MAbort- >SERR- <PERR- INTx-
	Latency: 0, Cache Line Size: 64 bytes
	Bus: primary=00, secondary=02, subordinate=02, sec-latency=0
	I/O behind bridge: 00002000-00002fff
	Memory behind bridge: d4000000-d5ffffff
	Prefetchable memory behind bridge: 00000000d0000000-00000000d1ffffff
	Secondary status: 66MHz- FastB2B- ParErr- DEVSEL=fast >TAbort-
<TAbort- <MAbort- <SERR- <PERR-
	BridgeCtl: Parity- SERR- NoISA+ VGA- MAbort- >Reset- FastB2B-
		PriDiscTmr- SecDiscTmr- DiscTmrStat- DiscTmrSERREn-
	Capabilities: [40] Express (v1) Root Port (Slot+), MSI 00
		DevCap:	MaxPayload 128 bytes, PhantFunc 0, Latency L0s unlimited, L1 unlimited
			ExtTag- RBE- FLReset-
		DevCtl:	Report errors: Correctable- Non-Fatal- Fatal- Unsupported-
			RlxdOrd- ExtTag- PhantFunc- AuxPwr- NoSnoop-
			MaxPayload 128 bytes, MaxReadReq 128 bytes
		DevSta:	CorrErr- UncorrErr- FatalErr- UnsuppReq- AuxPwr+ TransPend-
		LnkCap:	Port #1, Speed 2.5GT/s, Width x1, ASPM L0s L1, Latency L0
<256ns, L1 <4us
			ClockPM- Surprise- LLActRep+ BwNot-
		LnkCtl:	ASPM Disabled; RCB 64 bytes Disabled- Retrain- CommClk+
			ExtSynch- ClockPM- AutWidDis- BWInt- AutBWInt-
		LnkSta:	Speed 2.5GT/s, Width x1, TrErr- Train- SlotClk+ DLActive+
BWMgmt- ABWMgmt-
		SltCap:	AttnBtn- PwrCtrl- MRL- AttnInd- PwrInd- HotPlug+ Surprise+
			Slot #2, PowerLimit 6.500W; Interlock- NoCompl-
		SltCtl:	Enable: AttnBtn- PwrFlt- MRL- PresDet+ CmdCplt- HPIrq- LinkChg-
			Control: AttnInd Unknown, PwrInd Unknown, Power- Interlock-
		SltSta:	Status: AttnBtn- PowerFlt- MRL- CmdCplt- PresDet+ Interlock-
			Changed: MRL- PresDet- LinkState-
		RootCtl: ErrCorrectable- ErrNon-Fatal- ErrFatal- PMEIntEna- CRSVisible-
		RootCap: CRSVisible-
		RootSta: PME ReqID 0000, PMEStatus- PMEPending-
	Capabilities: [80] MSI: Enable+ Count=1/1 Maskable- 64bit-
		Address: fee0300c  Data: 4171
	Capabilities: [90] Subsystem: LG Electronics, Inc. Device 0040
	Capabilities: [a0] Power Management version 2
		Flags: PMEClk- DSI- D1- D2- AuxCurrent=0mA PME(D0+,D1-,D2-,D3hot+,D3cold+)
		Status: D0 NoSoftRst- PME-Enable- DSel=0 DScale=0 PME-
	Capabilities: [100 v1] Virtual Channel
		Caps:	LPEVC=0 RefClk=100ns PATEntryBits=1
		Arb:	Fixed+ WRR32- WRR64- WRR128-
		Ctrl:	ArbSelect=Fixed
		Status:	InProgress-
		VC0:	Caps:	PATOffset=00 MaxTimeSlots=1 RejSnoopTrans-
			Arb:	Fixed+ WRR32- WRR64- WRR128- TWRR128- WRR256-
			Ctrl:	Enable+ ID=0 ArbSelect=Fixed TC/VC=01
			Status:	NegoPending- InProgress-
		VC1:	Caps:	PATOffset=00 MaxTimeSlots=1 RejSnoopTrans-
			Arb:	Fixed+ WRR32- WRR64- WRR128- TWRR128- WRR256-
			Ctrl:	Enable- ID=0 ArbSelect=Fixed TC/VC=00
			Status:	NegoPending- InProgress-
	Capabilities: [180 v1] Root Complex Link
		Desc:	PortNumber=01 ComponentID=02 EltType=Config
		Link0:	Desc:	TargetPort=00 TargetComponent=02 AssocRCRB-
LinkType=MemMapped LinkValid+
			Addr:	00000000fed1c001
	Kernel driver in use: pcieport
	Kernel modules: shpchp

00:1c.2 PCI bridge: Intel Corporation N10/ICH 7 Family PCI Express
Port 3 (rev 02) (prog-if 00 [Normal decode])
	Control: I/O+ Mem+ BusMaster+ SpecCycle- MemWINV- VGASnoop- ParErr-
Stepping- SERR- FastB2B- DisINTx+
	Status: Cap+ 66MHz- UDF- FastB2B- ParErr- DEVSEL=fast >TAbort-
<TAbort- <MAbort- >SERR- <PERR- INTx-
	Latency: 0, Cache Line Size: 64 bytes
	Bus: primary=00, secondary=03, subordinate=04, sec-latency=0
	I/O behind bridge: 00003000-00003fff
	Memory behind bridge: d6000000-d7ffffff
	Prefetchable memory behind bridge: 00000000d2000000-00000000d3ffffff
	Secondary status: 66MHz- FastB2B- ParErr- DEVSEL=fast >TAbort-
<TAbort- <MAbort- <SERR- <PERR-
	BridgeCtl: Parity- SERR- NoISA+ VGA- MAbort- >Reset- FastB2B-
		PriDiscTmr- SecDiscTmr- DiscTmrStat- DiscTmrSERREn-
	Capabilities: [40] Express (v1) Root Port (Slot+), MSI 00
		DevCap:	MaxPayload 128 bytes, PhantFunc 0, Latency L0s unlimited, L1 unlimited
			ExtTag- RBE- FLReset-
		DevCtl:	Report errors: Correctable- Non-Fatal- Fatal- Unsupported-
			RlxdOrd- ExtTag- PhantFunc- AuxPwr- NoSnoop-
			MaxPayload 128 bytes, MaxReadReq 128 bytes
		DevSta:	CorrErr- UncorrErr- FatalErr- UnsuppReq- AuxPwr+ TransPend-
		LnkCap:	Port #3, Speed 2.5GT/s, Width x1, ASPM L0s L1, Latency L0
<1us, L1 <4us
			ClockPM- Surprise- LLActRep+ BwNot-
		LnkCtl:	ASPM Disabled; RCB 64 bytes Disabled- Retrain- CommClk-
			ExtSynch- ClockPM- AutWidDis- BWInt- AutBWInt-
		LnkSta:	Speed 2.5GT/s, Width x0, TrErr- Train- SlotClk+ DLActive-
BWMgmt- ABWMgmt-
		SltCap:	AttnBtn- PwrCtrl- MRL- AttnInd- PwrInd- HotPlug+ Surprise+
			Slot #4, PowerLimit 6.500W; Interlock- NoCompl-
		SltCtl:	Enable: AttnBtn- PwrFlt- MRL- PresDet+ CmdCplt- HPIrq- LinkChg-
			Control: AttnInd Unknown, PwrInd Unknown, Power- Interlock-
		SltSta:	Status: AttnBtn- PowerFlt- MRL- CmdCplt- PresDet- Interlock-
			Changed: MRL- PresDet- LinkState-
		RootCtl: ErrCorrectable- ErrNon-Fatal- ErrFatal- PMEIntEna- CRSVisible-
		RootCap: CRSVisible-
		RootSta: PME ReqID 0000, PMEStatus- PMEPending-
	Capabilities: [80] MSI: Enable+ Count=1/1 Maskable- 64bit-
		Address: fee0300c  Data: 4179
	Capabilities: [90] Subsystem: LG Electronics, Inc. Device 0040
	Capabilities: [a0] Power Management version 2
		Flags: PMEClk- DSI- D1- D2- AuxCurrent=0mA PME(D0+,D1-,D2-,D3hot+,D3cold+)
		Status: D0 NoSoftRst- PME-Enable- DSel=0 DScale=0 PME-
	Capabilities: [100 v1] Virtual Channel
		Caps:	LPEVC=0 RefClk=100ns PATEntryBits=1
		Arb:	Fixed+ WRR32- WRR64- WRR128-
		Ctrl:	ArbSelect=Fixed
		Status:	InProgress-
		VC0:	Caps:	PATOffset=00 MaxTimeSlots=1 RejSnoopTrans-
			Arb:	Fixed+ WRR32- WRR64- WRR128- TWRR128- WRR256-
			Ctrl:	Enable+ ID=0 ArbSelect=Fixed TC/VC=ff
			Status:	NegoPending- InProgress-
		VC1:	Caps:	PATOffset=00 MaxTimeSlots=1 RejSnoopTrans-
			Arb:	Fixed+ WRR32- WRR64- WRR128- TWRR128- WRR256-
			Ctrl:	Enable- ID=0 ArbSelect=Fixed TC/VC=00
			Status:	NegoPending- InProgress-
	Capabilities: [180 v1] Root Complex Link
		Desc:	PortNumber=03 ComponentID=02 EltType=Config
		Link0:	Desc:	TargetPort=00 TargetComponent=02 AssocRCRB-
LinkType=MemMapped LinkValid+
			Addr:	00000000fed1c001
	Kernel driver in use: pcieport
	Kernel modules: shpchp

00:1c.3 PCI bridge: Intel Corporation N10/ICH 7 Family PCI Express
Port 4 (rev 02) (prog-if 00 [Normal decode])
	Control: I/O+ Mem+ BusMaster+ SpecCycle- MemWINV- VGASnoop- ParErr-
Stepping- SERR- FastB2B- DisINTx+
	Status: Cap+ 66MHz- UDF- FastB2B- ParErr- DEVSEL=fast >TAbort-
<TAbort- <MAbort- >SERR- <PERR- INTx-
	Latency: 0, Cache Line Size: 64 bytes
	Bus: primary=00, secondary=05, subordinate=05, sec-latency=0
	I/O behind bridge: 00005000-00005fff
	Memory behind bridge: da100000-da1fffff
	Prefetchable memory behind bridge: 00000000a4000000-00000000a41fffff
	Secondary status: 66MHz- FastB2B- ParErr- DEVSEL=fast >TAbort-
<TAbort- <MAbort- <SERR- <PERR-
	BridgeCtl: Parity- SERR- NoISA+ VGA- MAbort- >Reset- FastB2B-
		PriDiscTmr- SecDiscTmr- DiscTmrStat- DiscTmrSERREn-
	Capabilities: [40] Express (v1) Root Port (Slot+), MSI 00
		DevCap:	MaxPayload 128 bytes, PhantFunc 0, Latency L0s unlimited, L1 unlimited
			ExtTag- RBE- FLReset-
		DevCtl:	Report errors: Correctable- Non-Fatal- Fatal- Unsupported-
			RlxdOrd- ExtTag- PhantFunc- AuxPwr- NoSnoop-
			MaxPayload 128 bytes, MaxReadReq 128 bytes
		DevSta:	CorrErr- UncorrErr- FatalErr- UnsuppReq- AuxPwr+ TransPend-
		LnkCap:	Port #4, Speed 2.5GT/s, Width x1, ASPM L0s L1, Latency L0
<256ns, L1 <4us
			ClockPM- Surprise- LLActRep+ BwNot-
		LnkCtl:	ASPM Disabled; RCB 64 bytes Disabled- Retrain- CommClk+
			ExtSynch- ClockPM- AutWidDis- BWInt- AutBWInt-
		LnkSta:	Speed 2.5GT/s, Width x1, TrErr- Train- SlotClk+ DLActive+
BWMgmt- ABWMgmt-
		SltCap:	AttnBtn- PwrCtrl- MRL- AttnInd- PwrInd- HotPlug+ Surprise+
			Slot #5, PowerLimit 6.500W; Interlock- NoCompl-
		SltCtl:	Enable: AttnBtn- PwrFlt- MRL- PresDet+ CmdCplt- HPIrq- LinkChg-
			Control: AttnInd Unknown, PwrInd Unknown, Power- Interlock-
		SltSta:	Status: AttnBtn- PowerFlt- MRL- CmdCplt- PresDet+ Interlock-
			Changed: MRL- PresDet- LinkState-
		RootCtl: ErrCorrectable- ErrNon-Fatal- ErrFatal- PMEIntEna- CRSVisible-
		RootCap: CRSVisible-
		RootSta: PME ReqID 0000, PMEStatus- PMEPending-
	Capabilities: [80] MSI: Enable+ Count=1/1 Maskable- 64bit-
		Address: fee0300c  Data: 4181
	Capabilities: [90] Subsystem: LG Electronics, Inc. Device 0040
	Capabilities: [a0] Power Management version 2
		Flags: PMEClk- DSI- D1- D2- AuxCurrent=0mA PME(D0+,D1-,D2-,D3hot+,D3cold+)
		Status: D0 NoSoftRst- PME-Enable- DSel=0 DScale=0 PME-
	Capabilities: [100 v1] Virtual Channel
		Caps:	LPEVC=0 RefClk=100ns PATEntryBits=1
		Arb:	Fixed+ WRR32- WRR64- WRR128-
		Ctrl:	ArbSelect=Fixed
		Status:	InProgress-
		VC0:	Caps:	PATOffset=00 MaxTimeSlots=1 RejSnoopTrans-
			Arb:	Fixed+ WRR32- WRR64- WRR128- TWRR128- WRR256-
			Ctrl:	Enable+ ID=0 ArbSelect=Fixed TC/VC=01
			Status:	NegoPending- InProgress-
		VC1:	Caps:	PATOffset=00 MaxTimeSlots=1 RejSnoopTrans-
			Arb:	Fixed+ WRR32- WRR64- WRR128- TWRR128- WRR256-
			Ctrl:	Enable- ID=0 ArbSelect=Fixed TC/VC=00
			Status:	NegoPending- InProgress-
	Capabilities: [180 v1] Root Complex Link
		Desc:	PortNumber=04 ComponentID=02 EltType=Config
		Link0:	Desc:	TargetPort=00 TargetComponent=02 AssocRCRB-
LinkType=MemMapped LinkValid+
			Addr:	00000000fed1c001
	Kernel driver in use: pcieport
	Kernel modules: shpchp

00:1d.0 USB controller: Intel Corporation N10/ICH 7 Family USB UHCI
Controller #1 (rev 02) (prog-if 00 [UHCI])
	Subsystem: LG Electronics, Inc. Device 0040
	Control: I/O+ Mem- BusMaster+ SpecCycle- MemWINV- VGASnoop- ParErr-
Stepping- SERR- FastB2B- DisINTx-
	Status: Cap- 66MHz- UDF- FastB2B+ ParErr- DEVSEL=medium >TAbort-
<TAbort- <MAbort- >SERR- <PERR- INTx-
	Latency: 0
	Interrupt: pin A routed to IRQ 23
	Region 4: I/O ports at 1800 [size=32]
	Kernel driver in use: uhci_hcd

00:1d.1 USB controller: Intel Corporation N10/ICH 7 Family USB UHCI
Controller #2 (rev 02) (prog-if 00 [UHCI])
	Subsystem: LG Electronics, Inc. Device 0040
	Control: I/O+ Mem- BusMaster+ SpecCycle- MemWINV- VGASnoop- ParErr-
Stepping- SERR- FastB2B- DisINTx-
	Status: Cap- 66MHz- UDF- FastB2B+ ParErr- DEVSEL=medium >TAbort-
<TAbort- <MAbort- >SERR- <PERR- INTx-
	Latency: 0
	Interrupt: pin B routed to IRQ 19
	Region 4: I/O ports at 1820 [size=32]
	Kernel driver in use: uhci_hcd

00:1d.2 USB controller: Intel Corporation N10/ICH 7 Family USB UHCI
Controller #3 (rev 02) (prog-if 00 [UHCI])
	Subsystem: LG Electronics, Inc. Device 0040
	Control: I/O+ Mem- BusMaster+ SpecCycle- MemWINV- VGASnoop- ParErr-
Stepping- SERR- FastB2B- DisINTx-
	Status: Cap- 66MHz- UDF- FastB2B+ ParErr- DEVSEL=medium >TAbort-
<TAbort- <MAbort- >SERR- <PERR- INTx-
	Latency: 0
	Interrupt: pin C routed to IRQ 18
	Region 4: I/O ports at 1840 [size=32]
	Kernel driver in use: uhci_hcd

00:1d.3 USB controller: Intel Corporation N10/ICH 7 Family USB UHCI
Controller #4 (rev 02) (prog-if 00 [UHCI])
	Subsystem: LG Electronics, Inc. Device 0040
	Control: I/O+ Mem- BusMaster+ SpecCycle- MemWINV- VGASnoop- ParErr-
Stepping- SERR- FastB2B- DisINTx-
	Status: Cap- 66MHz- UDF- FastB2B+ ParErr- DEVSEL=medium >TAbort-
<TAbort- <MAbort- >SERR- <PERR- INTx-
	Latency: 0
	Interrupt: pin D routed to IRQ 21
	Region 4: I/O ports at 1860 [size=32]
	Kernel driver in use: uhci_hcd

00:1d.7 USB controller: Intel Corporation N10/ICH 7 Family USB2 EHCI
Controller (rev 02) (prog-if 20 [EHCI])
	Subsystem: LG Electronics, Inc. Device 0040
	Control: I/O- Mem+ BusMaster+ SpecCycle- MemWINV- VGASnoop- ParErr-
Stepping- SERR- FastB2B- DisINTx-
	Status: Cap+ 66MHz- UDF- FastB2B+ ParErr- DEVSEL=medium >TAbort-
<TAbort- <MAbort- >SERR- <PERR- INTx-
	Latency: 0
	Interrupt: pin A routed to IRQ 23
	Region 0: Memory at da404000 (32-bit, non-prefetchable) [size=1K]
	Capabilities: [50] Power Management version 2
		Flags: PMEClk- DSI- D1- D2- AuxCurrent=375mA PME(D0+,D1-,D2-,D3hot+,D3cold+)
		Status: D0 NoSoftRst- PME-Enable- DSel=0 DScale=0 PME-
	Capabilities: [58] Debug port: BAR=1 offset=00a0
	Kernel driver in use: ehci_hcd

00:1e.0 PCI bridge: Intel Corporation 82801 Mobile PCI Bridge (rev e2)
(prog-if 01 [Subtractive decode])
	Control: I/O+ Mem+ BusMaster+ SpecCycle- MemWINV- VGASnoop- ParErr-
Stepping- SERR- FastB2B- DisINTx-
	Status: Cap+ 66MHz- UDF- FastB2B- ParErr- DEVSEL=fast >TAbort-
<TAbort- <MAbort- >SERR- <PERR- INTx-
	Latency: 0
	Bus: primary=00, secondary=06, subordinate=0a, sec-latency=56
	I/O behind bridge: 00004000-00004fff
	Memory behind bridge: da000000-da0fffff
	Prefetchable memory behind bridge: 00000000a0000000-00000000a3ffffff
	Secondary status: 66MHz- FastB2B+ ParErr- DEVSEL=medium >TAbort-
<TAbort- <MAbort+ <SERR- <PERR-
	BridgeCtl: Parity- SERR- NoISA+ VGA- MAbort- >Reset- FastB2B-
		PriDiscTmr- SecDiscTmr- DiscTmrStat- DiscTmrSERREn-
	Capabilities: [50] Subsystem: LG Electronics, Inc. Device 0040

00:1f.0 ISA bridge: Intel Corporation 82801GBM (ICH7-M) LPC Interface
Bridge (rev 02)
	Subsystem: LG Electronics, Inc. Device 0040
	Control: I/O+ Mem+ BusMaster+ SpecCycle- MemWINV- VGASnoop- ParErr-
Stepping- SERR- FastB2B- DisINTx-
	Status: Cap+ 66MHz- UDF- FastB2B- ParErr- DEVSEL=medium >TAbort-
<TAbort- <MAbort- >SERR- <PERR- INTx-
	Latency: 0
	Capabilities: [e0] Vendor Specific Information: Len=0c <?>
	Kernel modules: leds-ss4200, iTCO_wdt, intel-rng

00:1f.1 IDE interface: Intel Corporation 82801G (ICH7 Family) IDE
Controller (rev 02) (prog-if 8a [Master SecP PriP])
	Subsystem: LG Electronics, Inc. Device 0040
	Control: I/O+ Mem- BusMaster+ SpecCycle- MemWINV- VGASnoop- ParErr-
Stepping- SERR- FastB2B- DisINTx-
	Status: Cap- 66MHz- UDF- FastB2B+ ParErr- DEVSEL=medium >TAbort-
<TAbort- <MAbort- >SERR- <PERR- INTx-
	Latency: 0
	Interrupt: pin B routed to IRQ 19
	Region 0: I/O ports at 01f0 [size=8]
	Region 1: I/O ports at 03f4 [size=1]
	Region 2: I/O ports at 0170 [size=8]
	Region 3: I/O ports at 0374 [size=1]
	Region 4: I/O ports at 1880 [size=16]
	Kernel driver in use: ata_piix

00:1f.2 SATA controller: Intel Corporation 82801GBM/GHM (ICH7-M
Family) SATA Controller [AHCI mode] (rev 02) (prog-if 01 [AHCI 1.0])
	Subsystem: LG Electronics, Inc. Device 0040
	Control: I/O+ Mem+ BusMaster+ SpecCycle- MemWINV- VGASnoop- ParErr-
Stepping- SERR- FastB2B- DisINTx+
	Status: Cap+ 66MHz+ UDF- FastB2B+ ParErr- DEVSEL=medium >TAbort-
<TAbort- <MAbort- >SERR- <PERR- INTx-
	Latency: 0
	Interrupt: pin B routed to IRQ 44
	Region 0: I/O ports at 18c8 [size=8]
	Region 1: I/O ports at 18ac [size=4]
	Region 2: I/O ports at 18c0 [size=8]
	Region 3: I/O ports at 18a8 [size=4]
	Region 4: I/O ports at 18b0 [size=16]
	Region 5: Memory at da404400 (32-bit, non-prefetchable) [size=1K]
	Capabilities: [80] MSI: Enable+ Count=1/1 Maskable- 64bit-
		Address: fee0300c  Data: 4189
	Capabilities: [70] Power Management version 2
		Flags: PMEClk- DSI- D1- D2- AuxCurrent=0mA PME(D0-,D1-,D2-,D3hot+,D3cold-)
		Status: D0 NoSoftRst- PME-Enable- DSel=0 DScale=0 PME-
	Kernel driver in use: ahci

00:1f.3 SMBus: Intel Corporation N10/ICH 7 Family SMBus Controller (rev 02)
	Subsystem: LG Electronics, Inc. Device 0040
	Control: I/O+ Mem- BusMaster- SpecCycle- MemWINV- VGASnoop- ParErr-
Stepping- SERR- FastB2B- DisINTx-
	Status: Cap- 66MHz- UDF- FastB2B+ ParErr- DEVSEL=medium >TAbort-
<TAbort- <MAbort- >SERR- <PERR- INTx-
	Interrupt: pin B routed to IRQ 11
	Region 4: I/O ports at 18e0 [size=32]
	Kernel modules: i2c-i801

01:00.0 VGA compatible controller: NVIDIA Corporation G72M [GeForce Go
7400] (rev a1) (prog-if 00 [VGA controller])
	Subsystem: LG Electronics, Inc. Device 0040
	Control: I/O+ Mem+ BusMaster+ SpecCycle- MemWINV- VGASnoop- ParErr-
Stepping- SERR- FastB2B- DisINTx-
	Status: Cap+ 66MHz- UDF- FastB2B- ParErr- DEVSEL=fast >TAbort-
<TAbort- <MAbort- >SERR- <PERR- INTx-
	Latency: 0, Cache Line Size: 64 bytes
	Interrupt: pin A routed to IRQ 16
	Region 0: Memory at d9000000 (32-bit, non-prefetchable) [size=16M]
	Region 1: Memory at c0000000 (64-bit, prefetchable) [size=256M]
	Region 3: Memory at d8000000 (64-bit, non-prefetchable) [size=16M]
	Expansion ROM at <unassigned> [disabled]
	Capabilities: [60] Power Management version 2
		Flags: PMEClk- DSI- D1- D2- AuxCurrent=0mA PME(D0-,D1-,D2-,D3hot-,D3cold-)
		Status: D0 NoSoftRst- PME-Enable- DSel=0 DScale=0 PME-
	Capabilities: [68] MSI: Enable- Count=1/1 Maskable- 64bit+
		Address: 0000000000000000  Data: 0000
	Capabilities: [78] Express (v1) Endpoint, MSI 00
		DevCap:	MaxPayload 128 bytes, PhantFunc 0, Latency L0s <256ns, L1 <4us
			ExtTag- AttnBtn- AttnInd- PwrInd- RBE- FLReset-
		DevCtl:	Report errors: Correctable- Non-Fatal- Fatal- Unsupported-
			RlxdOrd+ ExtTag- PhantFunc- AuxPwr- NoSnoop+
			MaxPayload 128 bytes, MaxReadReq 512 bytes
		DevSta:	CorrErr- UncorrErr+ FatalErr- UnsuppReq+ AuxPwr- TransPend-
		LnkCap:	Port #0, Speed 2.5GT/s, Width x16, ASPM L0s L1, Latency L0
<256ns, L1 <4us
			ClockPM- Surprise- LLActRep- BwNot-
		LnkCtl:	ASPM Disabled; RCB 128 bytes Disabled- Retrain- CommClk+
			ExtSynch- ClockPM- AutWidDis- BWInt- AutBWInt-
		LnkSta:	Speed 2.5GT/s, Width x16, TrErr- Train- SlotClk+ DLActive-
BWMgmt- ABWMgmt-
	Capabilities: [100 v1] Virtual Channel
		Caps:	LPEVC=0 RefClk=100ns PATEntryBits=1
		Arb:	Fixed- WRR32- WRR64- WRR128-
		Ctrl:	ArbSelect=Fixed
		Status:	InProgress-
		VC0:	Caps:	PATOffset=00 MaxTimeSlots=1 RejSnoopTrans-
			Arb:	Fixed- WRR32- WRR64- WRR128- TWRR128- WRR256-
			Ctrl:	Enable+ ID=0 ArbSelect=Fixed TC/VC=01
			Status:	NegoPending- InProgress-
	Capabilities: [128 v1] Power Budgeting <?>
	Kernel driver in use: nouveau
	Kernel modules: nouveau, nvidiafb

02:00.0 Ethernet controller: LSI Corporation ET-131x PCI-E Ethernet
Controller (rev 02)
	Subsystem: LG Electronics, Inc. Device 0040
	Control: I/O- Mem+ BusMaster+ SpecCycle- MemWINV- VGASnoop- ParErr-
Stepping- SERR- FastB2B- DisINTx-
	Status: Cap+ 66MHz- UDF- FastB2B- ParErr- DEVSEL=fast >TAbort-
<TAbort- <MAbort- >SERR- <PERR- INTx-
	Latency: 0, Cache Line Size: 64 bytes
	Interrupt: pin A routed to IRQ 16
	Region 0: Memory at d4000000 (64-bit, non-prefetchable) [size=2M]
	[virtual] Expansion ROM at d0000000 [disabled] [size=128K]
	Capabilities: [40] Power Management version 2
		Flags: PMEClk- DSI- D1+ D2- AuxCurrent=0mA PME(D0+,D1+,D2-,D3hot+,D3cold+)
		Status: D0 NoSoftRst- PME-Enable- DSel=0 DScale=0 PME-
	Capabilities: [48] Express (v1) Endpoint, MSI 00
		DevCap:	MaxPayload 256 bytes, PhantFunc 0, Latency L0s <4us, L1 <32us
			ExtTag- AttnBtn- AttnInd- PwrInd- RBE- FLReset-
		DevCtl:	Report errors: Correctable- Non-Fatal- Fatal- Unsupported-
			RlxdOrd- ExtTag- PhantFunc- AuxPwr- NoSnoop-
			MaxPayload 128 bytes, MaxReadReq 2048 bytes
		DevSta:	CorrErr- UncorrErr+ FatalErr- UnsuppReq+ AuxPwr+ TransPend-
		LnkCap:	Port #0, Speed 2.5GT/s, Width x1, ASPM L0s L1, Latency L0
<1us, L1 <32us
			ClockPM- Surprise- LLActRep- BwNot-
		LnkCtl:	ASPM Disabled; RCB 64 bytes Disabled- Retrain- CommClk+
			ExtSynch- ClockPM- AutWidDis- BWInt- AutBWInt-
		LnkSta:	Speed 2.5GT/s, Width x1, TrErr- Train- SlotClk+ DLActive-
BWMgmt- ABWMgmt-
	Capabilities: [5c] MSI: Enable- Count=1/1 Maskable- 64bit+
		Address: 0000000000000000  Data: 0000
	Capabilities: [100 v1] Advanced Error Reporting
		UESta:	DLP- SDES- TLP- FCP- CmpltTO- CmpltAbrt- UnxCmplt- RxOF-
MalfTLP- ECRC- UnsupReq+ ACSViol-
		UEMsk:	DLP+ SDES- TLP+ FCP+ CmpltTO+ CmpltAbrt+ UnxCmplt+ RxOF+
MalfTLP+ ECRC+ UnsupReq+ ACSViol-
		UESvrt:	DLP+ SDES- TLP- FCP+ CmpltTO- CmpltAbrt- UnxCmplt- RxOF+
MalfTLP+ ECRC- UnsupReq- ACSViol-
		CESta:	RxErr- BadTLP- BadDLLP- Rollover- Timeout- NonFatalErr-
		CEMsk:	RxErr+ BadTLP+ BadDLLP+ Rollover+ Timeout+ NonFatalErr-
		AERCap:	First Error Pointer: 00, GenCap+ CGenEn- ChkCap+ ChkEn-
	Capabilities: [130 v1] Virtual Channel
		Caps:	LPEVC=0 RefClk=100ns PATEntryBits=1
		Arb:	Fixed- WRR32- WRR64- WRR128-
		Ctrl:	ArbSelect=Fixed
		Status:	InProgress-
		VC0:	Caps:	PATOffset=00 MaxTimeSlots=1 RejSnoopTrans-
			Arb:	Fixed- WRR32- WRR64- WRR128- TWRR128- WRR256-
			Ctrl:	Enable+ ID=0 ArbSelect=Fixed TC/VC=01
			Status:	NegoPending- InProgress-
	Capabilities: [14c v1] Device Serial Number 9a-78-56-34-12-2d-02-00
	Kernel driver in use: et131x
	Kernel modules: et131x

05:00.0 Network controller: Intel Corporation PRO/Wireless 3945ABG
[Golan] Network Connection (rev 02)
	Subsystem: Intel Corporation PRO/Wireless 3945BG Network Connection
	Control: I/O- Mem+ BusMaster+ SpecCycle- MemWINV- VGASnoop- ParErr-
Stepping- SERR- FastB2B- DisINTx+
	Status: Cap+ 66MHz- UDF- FastB2B- ParErr- DEVSEL=fast >TAbort-
<TAbort- <MAbort- >SERR- <PERR- INTx-
	Latency: 0, Cache Line Size: 64 bytes
	Interrupt: pin A routed to IRQ 45
	Region 0: Memory at da100000 (32-bit, non-prefetchable) [size=4K]
	Capabilities: [c8] Power Management version 2
		Flags: PMEClk- DSI+ D1- D2- AuxCurrent=0mA PME(D0+,D1-,D2-,D3hot+,D3cold+)
		Status: D0 NoSoftRst- PME-Enable- DSel=0 DScale=0 PME-
	Capabilities: [d0] MSI: Enable+ Count=1/1 Maskable- 64bit+
		Address: 00000000fee0300c  Data: 4191
	Capabilities: [e0] Express (v1) Legacy Endpoint, MSI 00
		DevCap:	MaxPayload 128 bytes, PhantFunc 0, Latency L0s <512ns, L1 unlimited
			ExtTag- AttnBtn- AttnInd- PwrInd- RBE- FLReset-
		DevCtl:	Report errors: Correctable- Non-Fatal- Fatal- Unsupported-
			RlxdOrd+ ExtTag- PhantFunc- AuxPwr- NoSnoop+
			MaxPayload 128 bytes, MaxReadReq 128 bytes
		DevSta:	CorrErr- UncorrErr+ FatalErr- UnsuppReq+ AuxPwr+ TransPend-
		LnkCap:	Port #0, Speed 2.5GT/s, Width x1, ASPM L0s L1, Latency L0
<128ns, L1 <64us
			ClockPM+ Surprise- LLActRep- BwNot-
		LnkCtl:	ASPM Disabled; RCB 64 bytes Disabled- Retrain- CommClk+
			ExtSynch- ClockPM- AutWidDis- BWInt- AutBWInt-
		LnkSta:	Speed 2.5GT/s, Width x1, TrErr- Train- SlotClk+ DLActive-
BWMgmt- ABWMgmt-
	Capabilities: [100 v1] Advanced Error Reporting
		UESta:	DLP- SDES- TLP- FCP- CmpltTO- CmpltAbrt- UnxCmplt- RxOF-
MalfTLP- ECRC- UnsupReq+ ACSViol-
		UEMsk:	DLP- SDES- TLP- FCP- CmpltTO- CmpltAbrt- UnxCmplt- RxOF-
MalfTLP- ECRC- UnsupReq- ACSViol-
		UESvrt:	DLP+ SDES- TLP- FCP+ CmpltTO- CmpltAbrt- UnxCmplt- RxOF+
MalfTLP+ ECRC- UnsupReq- ACSViol-
		CESta:	RxErr- BadTLP- BadDLLP- Rollover- Timeout- NonFatalErr-
		CEMsk:	RxErr- BadTLP- BadDLLP- Rollover- Timeout- NonFatalErr-
		AERCap:	First Error Pointer: 14, GenCap- CGenEn- ChkCap- ChkEn-
	Capabilities: [140 v1] Device Serial Number 00-18-de-ff-ff-77-a4-02
	Kernel driver in use: iwl3945
	Kernel modules: iwl3945

06:00.0 CardBus bridge: Texas Instruments PCIxx12 Cardbus Controller
	Subsystem: LG Electronics, Inc. Device 0040
	Control: I/O+ Mem+ BusMaster+ SpecCycle- MemWINV- VGASnoop- ParErr-
Stepping- SERR- FastB2B- DisINTx-
	Status: Cap+ 66MHz- UDF- FastB2B- ParErr- DEVSEL=medium >TAbort-
<TAbort- <MAbort- >SERR- <PERR- INTx-
	Latency: 168, Cache Line Size: 64 bytes
	Interrupt: pin A routed to IRQ 16
	Region 0: Memory at a8000000 (32-bit, non-prefetchable) [size=4K]
	Bus: primary=06, secondary=07, subordinate=0a, sec-latency=176
	Memory window 0: a0000000-a3fff000 (prefetchable)
	Memory window 1: ac000000-affff000
	I/O window 0: 00004400-000044ff
	I/O window 1: 00004000-000040ff
	BridgeCtl: Parity- SERR- ISA- VGA- MAbort- >Reset+ 16bInt+ PostWrite+
	16-bit legacy interface ports at 0001
	Kernel driver in use: yenta_cardbus
	Kernel modules: yenta_socket

06:00.1 FireWire (IEEE 1394): Texas Instruments PCIxx12 OHCI Compliant
IEEE 1394 Host Controller (prog-if 10 [OHCI])
	Subsystem: LG Electronics, Inc. Device 0040
	Control: I/O- Mem+ BusMaster+ SpecCycle- MemWINV+ VGASnoop- ParErr-
Stepping- SERR- FastB2B- DisINTx-
	Status: Cap+ 66MHz- UDF- FastB2B- ParErr- DEVSEL=medium >TAbort-
<TAbort- <MAbort- >SERR- <PERR- INTx-
	Latency: 32 (500ns min, 1000ns max), Cache Line Size: 64 bytes
	Interrupt: pin A routed to IRQ 16
	Region 0: Memory at da005000 (32-bit, non-prefetchable) [size=2K]
	Region 1: Memory at da000000 (32-bit, non-prefetchable) [size=16K]
	Capabilities: [44] Power Management version 2
		Flags: PMEClk- DSI- D1+ D2+ AuxCurrent=0mA PME(D0+,D1+,D2+,D3hot+,D3cold-)
		Status: D0 NoSoftRst- PME-Enable- DSel=0 DScale=0 PME+
	Kernel driver in use: firewire_ohci
	Kernel modules: firewire-ohci

06:00.2 Mass storage controller: Texas Instruments 5-in-1 Multimedia
Card Reader (SD/MMC/MS/MS PRO/xD)
	Subsystem: LG Electronics, Inc. Device 0040
	Control: I/O- Mem+ BusMaster+ SpecCycle- MemWINV- VGASnoop- ParErr-
Stepping- SERR- FastB2B- DisINTx-
	Status: Cap+ 66MHz- UDF- FastB2B- ParErr- DEVSEL=medium >TAbort-
<TAbort- <MAbort- >SERR- <PERR- INTx-
	Latency: 57 (1750ns min, 1000ns max), Cache Line Size: 64 bytes
	Interrupt: pin A routed to IRQ 16
	Region 0: Memory at da004000 (32-bit, non-prefetchable) [size=4K]
	Capabilities: [44] Power Management version 2
		Flags: PMEClk- DSI- D1+ D2+ AuxCurrent=0mA PME(D0+,D1+,D2+,D3hot+,D3cold-)
		Status: D0 NoSoftRst- PME-Enable- DSel=0 DScale=0 PME-
	Kernel driver in use: tifm_7xx1
	Kernel modules: tifm_7xx1

06:00.3 SD Host controller: Texas Instruments PCIxx12 SDA Standard
Compliant SD Host Controller
	Subsystem: LG Electronics, Inc. Device 0040
	Control: I/O- Mem+ BusMaster+ SpecCycle- MemWINV- VGASnoop- ParErr-
Stepping- SERR- FastB2B- DisINTx-
	Status: Cap+ 66MHz- UDF- FastB2B- ParErr- DEVSEL=medium >TAbort-
<TAbort- <MAbort- >SERR- <PERR- INTx-
	Latency: 57 (1750ns min, 1000ns max), Cache Line Size: 64 bytes
	Interrupt: pin A routed to IRQ 16
	Region 0: Memory at da005800 (32-bit, non-prefetchable) [size=256]
	Capabilities: [80] Power Management version 2
		Flags: PMEClk- DSI- D1+ D2+ AuxCurrent=0mA PME(D0+,D1+,D2+,D3hot+,D3cold-)
		Status: D0 NoSoftRst- PME-Enable- DSel=0 DScale=0 PME-
	Kernel driver in use: sdhci-pci
	Kernel modules: sdhci-pci


** SCSI information:
Attached devices:
Host: scsi0 Channel: 00 Id: 00 Lun: 00
  Vendor: ATA      Model: HTS541010G9SA00  Rev: MBZO
  Type:   Direct-Access                    ANSI  SCSI revision: 05
Host: scsi4 Channel: 00 Id: 00 Lun: 00
  Vendor: HL-DT-ST Model: DVDRAM GSA-T10N  Rev: PH03
  Type:   CD-ROM                           ANSI  SCSI revision: 05
